{
  "schema_version": "2",
  "tool_name": "hl7v2-cli",
  "tool_version": "1.5.0",
  "phi_removed": true,
  "hash_algorithm": "sha256",
  "actions": [
    {
      "path": "PID.3",
      "action": "hash",
      "reason": "patient identifier",
      "matched_count": 1,
      "optional": false,
      "status": "applied"
    },
    {
      "path": "PID.5",
      "action": "drop",
      "reason": "patient name",
      "matched_count": 1,
      "optional": false,
      "status": "applied"
    },
    {
      "path": "PID.7",
      "action": "drop",
      "reason": "date of birth",
      "matched_count": 1,
      "optional": false,
      "status": "applied"
    },
    {
      "path": "PID.11",
      "action": "drop",
      "reason": "patient address",
      "matched_count": 1,
      "optional": false,
      "status": "applied"
    },
    {
      "path": "MSH.9",
      "action": "retain",
      "reason": "message type is needed for analysis",
      "matched_count": 1,
      "optional": false,
      "status": "retained"
    },
    {
      "path": "MSH.10",
      "action": "retain",
      "reason": "control id is needed for replay correlation",
      "matched_count": 1,
      "optional": false,
      "status": "retained"
    },
    {
      "path": "OBX.3",
      "action": "retain",
      "reason": "observation identifier is needed for analysis",
      "matched_count": 1,
      "optional": false,
      "status": "retained"
    },
    {
      "path": "OBX.5",
      "action": "retain",
      "reason": "non-PHI synthetic observation value shape is needed for analysis",
      "matched_count": 1,
      "optional": false,
      "status": "retained"
    }
  ]
}
